{
  "evidence_id": "ev-7a723b261b50",
  "repository_pin": "pins/v1-census/federation-recon.json",
  "procedure_id": "node-census-v1",
  "procedure_version": "v1",
  "observation_type": "manifest_field",
  "value": "2026-08-09T18:37:38Z", "paths": ["/ (repo root)"], "hashes": {"field": "last_commit_date"}
}
