{
  "evidence_id": "ev-f02a80626b65",
  "repository_pin": "pins/v1-census/steward-protocol.json",
  "procedure_id": "node-census-v1",
  "procedure_version": "v1",
  "observation_type": "manifest_field",
  "value": null, "paths": [".well-known/agent-federation.json"], "hashes": {"field": "tier_or_layer"}
}
