{
  "evidence_id": "ev-d4eb0215fe66",
  "repository_pin": "pins/v1-census/steward-federation.json",
  "procedure_id": "node-census-v1",
  "procedure_version": "v1",
  "observation_type": "manifest_field",
  "value": "2026-09-08T05:04:13Z", "paths": ["/ (repo root)"], "hashes": {"field": "last_commit_date"}
}
