{
  "evidence_id": "ev-430b5a477c60",
  "repository_pin": "pins/v1-census/agent-city.json",
  "procedure_id": "node-census-v1",
  "procedure_version": "v1",
  "observation_type": "manifest_field",
  "value": "city_runtime", "paths": [".well-known/agent-federation.json"], "hashes": {"field": "role"}
}
