{
  "evidence_id": "ev-3f285695cef1",
  "repository_pin": "pins/v1-census/agent-city.json",
  "procedure_id": "node-census-v1",
  "procedure_version": "v1",
  "observation_type": "manifest_field",
  "value": "2026-08-06T17:04:30Z", "paths": ["/ (repo root)"], "hashes": {"field": "last_commit_date"}
}
