{
  "evidence_id": "ev-2200ee4df3ff",
  "repository_pin": "pins/v1-census/agent-music.json",
  "procedure_id": "node-census-v1",
  "procedure_version": "v1",
  "observation_type": "manifest_field",
  "value": "2026-07-30T07:17:02Z", "paths": ["/ (repo root)"], "hashes": {"field": "last_commit_date"}
}
