{
  "evidence_id": "ev-372b368dd06d",
  "repository_pin": "pins/v1-census/agent-internet.json",
  "procedure_id": "node-census-v1",
  "procedure_version": "v1",
  "observation_type": "manifest_field",
  "value": "agent_federation_descriptor", "paths": [".well-known/agent-federation.json"], "hashes": {"field": "role"}
}
