{
  "evidence_id": "ev-5ea273e5dd9d",
  "repository_pin": "pins/v1-census/hermes-sankhya-25.json",
  "procedure_id": "node-census-v1",
  "procedure_version": "v1",
  "observation_type": "manifest_field",
  "value": "2026-07-30T03:33:43Z", "paths": ["/ (repo root)"], "hashes": {"field": "last_commit_date"}
}
