{
  "evidence_id": "ev-95fb6bd5483b",
  "repository_pin": "pins/agent-internet.json",
  "procedure_id": "node-census-v1",
  "procedure_version": "v1",
  "observation_type": "manifest_field",
  "value": "agent_federation_descriptor", "paths": [".well-known/agent-federation.json"], "hashes": {"field": "role"}
}
