{
  "evidence_id": "ev-260486687067",
  "repository_pin": "pins/v0-boundary-drift/agent-internet.json",
  "procedure_id": "boundary-drift-recon-v0",
  "procedure_version": "v0",
  "observation_type": "manifest_field",
  "value": "role=;owner_boundary=", "paths": [".well-known/agent-federation.json"]
}
