{
  "evidence_id": "ev-9aec7b647264",
  "repository_pin": "pins/v0-boundary-drift/agent-world.json",
  "procedure_id": "boundary-drift-recon-v0",
  "procedure_version": "v0",
  "observation_type": "file_count",
  "value": 9, "paths": ["docs/REPO_BOUNDARIES.md"], "hashes": {"sha256": "19581e27de7ced00ff1ce50b2047e7a567c76b1cbaebabe5ef03f7c3017bb5b7"}
}
