{
  "evidence_id": "ev-dc173115dbb4",
  "repository_pin": "pins/steward-protocol.json",
  "procedure_id": "node-census-v1",
  "procedure_version": "v1",
  "observation_type": "manifest_field",
  "value": "agent_federation_descriptor", "paths": [".well-known/agent-federation.json"], "hashes": {"field": "role"}
}
