{
  "evidence_id": "ev-25c782f6cc12",
  "repository_pin": "pins/v0-boundary-drift/agent-world.json",
  "procedure_id": "boundary-drift-recon-v0",
  "procedure_version": "v0",
  "observation_type": "manifest_field",
  "value": "world_governance_surface", "paths": [".well-known/agent-federation.json"], "hashes": {"owner_boundary": "cf0eed155a02560d7467e542a5be74376cefa4906f07ea3c9286b47c63c719ce"}
}
