{
  "evidence_id": "ev-c565f27ad1d0",
  "repository_pin": "pins/v1-census/hermes-sankhya-25.json",
  "procedure_id": "node-census-v1",
  "procedure_version": "v1",
  "observation_type": "manifest_field",
  "value": "node", "paths": [".well-known/agent-federation.json"], "hashes": {"field": "tier_or_layer"}
}
