{
  "evidence_id": "ev-da542fdbb8f6",
  "repository_pin": "pins/v0-boundary-drift/steward.json",
  "procedure_id": "boundary-drift-recon-v0",
  "procedure_version": "v0",
  "observation_type": "manifest_field",
  "value": "steward_surface", "paths": [".well-known/agent-federation.json"], "hashes": {"owner_boundary": "8aabed3d729416005a66864501b3286c81f04eff6662daed8432350f0468e8d5"}
}
