{
  "evidence_id": "ev-c2ff38bb579d",
  "repository_pin": "pins/v1-census/agent-internet.json",
  "procedure_id": "node-census-v1",
  "procedure_version": "v1",
  "observation_type": "manifest_field",
  "value": "internet", "paths": [".well-known/agent-federation.json"], "hashes": {"field": "tier_or_layer"}
}
